{
  "schema_version": "1.0",
  "meta": {
    "target_role": "",
    "career_level": "",
    "template_id": ""
  },
  "personal": {
    "full_name": "",
    "email": "",
    "phone": "",
    "location": "",
    "linkedin": "",
    "github": "",
    "portfolio": ""
  },
  "summary": "",
  "skills": [],
  "education": [],
  "experience": [],
  "projects": [],
  "certifications": [],
  "achievements": [],
  "languages": []
}
